<?xml version="1.0" encoding="utf-8"?>
<messaging-config xmlns:xsi="http://www.w3.org/2001/XMLSchema-instance"
                         xsi:noNamespaceSchemaLocation="./../../../../../../../Gate/src/com/rssl/phizic/gate/messaging/configuration/messaging.xsd">

	<request endpoint="retail" name="internalTransfer_q" subsystem="business">
		<response name="internalTransfer_a"/>
	</request>

	<request endpoint="retail" name="openDeposit_q" subsystem="business">
		<response name="openDeposit_a"/>
	</request>

	<request endpoint="retail" name="closeDeposit_q" subsystem="business">
		<response name="closeDeposit_a"/>
	</request>

	<request endpoint="retail" name="externalTransfer_q" subsystem="business">
		<response name="externalTransfer_a"/>
	</request>

	<request endpoint="retail" name="carryDeposit_q" subsystem="scheduler">
		<response name="carryDeposit_a"/>
		<attribute name="needParseError" value="false"/>
	</request>

	<request endpoint="retail" name="getDepositList_q" subsystem="business">
		<response name="getDepositList_a"/>
	</request>

	<request endpoint="retail" name="depositProduct_q" subsystem="business">
		<response name="depositProduct_a"/>
	</request>

	<request endpoint="retail" name="getClientDepositInfo_q" subsystem="business" cacheKeyClass="com.rssl.phizicgate.rsretailV6r20.cache.ClientDepositInfoQ">
		<response name="getClientDepositInfo_a"/>
	</request>

	<request endpoint="retail" name="commissionPay_q" subsystem="business">
		<response name="commissionPay_a"/>
	</request>

	<request endpoint="retail" name="recallDocument_q" subsystem="business">
		<response name="recallDocument_a"/>
	</request>

	<request endpoint="retail" name="getAccountTransactions_q" subsystem="business">
		<response name="getAccountTransactions_a"/>
	</request>

	<request endpoint="retail" name="getCurrencyRate_q" subsystem="business" cacheKeyClass="com.rssl.phizicgate.rsretailV6r20.cache.GetCurrencyRateQ">
		<response name="getCurrencyRate_a"/>
	</request>

    <request endpoint="retail" name="getRateCB_q" subsystem="business">
        <response name="getRateCB_a"/>
    </request>

	<request endpoint="retail" name="serviceFeePayment_q" subsystem="business">
		<response name="serviceFeePayment_a"/>
	</request>

	<request endpoint="retail" name="getReferencFromDocument_q" subsystem="scheduler">
		<response name="getReferencFromDocument_a"/>
	</request>

	<request name="nextWorkDate_q" endpoint="retail" subsystem="business">
		<response name="nextWorkDate_a"/>
	</request>
	<request name="validatePayment_q" endpoint="retail" subsystem="business">
		<response name="validatePayment_a"/>
	</request>
	<request endpoint="retail" name="savingsBookLoss_q" subsystem="business">
		<response name="savingsBookLoss_a"/>
	</request>
</messaging-config>
